NCT Number,Study Title,Brief Summary,Conditions
NCT00433173,Insulin Sensitivity in Men With the Metabolic Syndrome,"The metabolic syndrome is a medical condition defined by high levels of cholesterol in the blood, high blood pressure, central obesity (gain in fat around the region of the stomach), and insulin resistance (body responds less well to insulin). This state of impaired insulin resistance can lead to type 2 diabetes mellitus, which is one of the most common metabolic disorders in the U.S. Numerous studies have shown an inverse relationship between insulin resistance and testosterone levels in men, however, causality has not been established. This protocol investigates the role of testosterone in modulating insulin sensitivity in insulin resistant states such as the metabolic syndrome. The hypothesis is that testosterone administration will improve insulin sensitivity.",Metabolic Syndrome
NCT04223973,MEDTRUM A7+ TouchCare Insulin Patch Pump (MedInPS),Demonstration study of the interest of the MEDTRUM A7+ TouchCare insulin patch pump versus INSULET Omnipod® patch pump,Diabetes Mellitus
NCT00596427,Mechanisms of Glucose Lowering Effect of Colesevelam HCl,"The mechanism by which colesevelam HCl lowers glucose is not known. Knowledge of the potential mechanism of action is important for defining the role of the drug among oral antidiabetic agents available for use in subjects with diabetes. The objective of this study is to provide insight into the mechanisms of action of colesevelam HCl in T2DM. The mechanisms of interest include hepatic insulin sensitivity, rate of appearance of exogenous glucose and changes in incretin hormone concentrations.",Diabetes
NCT02073227,A Bioequivalence Study of the Fixed Dose Combination Tablets of Canagliflozin and Metformin Extended Release (XR) With Respect to the Individual Components,"The purpose of this study is to assess the bioequivalence of the fixed dose combination (two components combined in one tablet) of canagliflozin and metformin extended release (XR) tablet (dose of 2 X 150 mg/1,000 mg) with respect to the individual components of canagliflozin (1 x 300 mg) and metformin XR tablet (4 x 500 mg) in healthy fed participants.",Healthy Volunteers
NCT00833027,ALPHA Sitagliptin Add on to Metformin (0431-103),Canadian physicians to experience in real life clinical practice the efficacy and tolerability of adding sitagliptin to their patients who have their glycemic levels inadequately controlled while on metformin,Diabetes Mellitus
NCT01865227,"Obesity Surgery, Counseling, and Psychological Well-Being","Obesity has become a global epidemic causing enormous human and economic costs. Incidence rates have doubled over the last few decades and obesity-related illnesses such as diabetes and cardiovascular diseases now constitute one of the major contributors to the global burden of disability. Overall, obesity has been recognized as one of the most pressing public health concerns worldwide and effective treatment and prevention strategies are urgently required. While behavioral and pharmacological treatments (e.g.low calorie diets, medication) are successful means for overcoming overweight and mild obesity, more severe cases of obesity usually fail to respond to such interventions. As a result, the demand for weight loss surgery is growing among this population. However, uncertainties about the effectiveness of obesity surgery persist and high relapse rates (i.e. weight regain) are common. Further research in this field is needed to identify risk factors that may trigger relapse and to understand patients' treatment needs in greater depth. Previous studies have pointed toward high levels of mental health problems among patients. However, the impact of preoperative psychopathology on actual surgery outcomes remains unclear. Similarly, few studies have investigated the effect of postoperative therapy on patients' psychological functioning and weight loss patterns. Research addressing these gaps is imperative to establish best-practice approaches. This challenge applies in particular to Middle East and North Africa(MENA) countries where research in the field of bariatric surgery and related mental health is largely missing. This is a major concern given the fact that the MENA region experienced the highest increase in overweight and obesity in recent decades compared to other countries.The proposed study aims to address this deficiency by examining obesity surgery patients in two Arab countries (UAE and Jordan). The goals of the project are to investigate the nature and extent of psychological health concerns among these patients before and after surgery and potential associations with treatment outcomes. Moreover, it will test the efficacy of post-operative counseling to improve weight loss and psychological health. For this purpose, a randomized clinical trial design will be employed so that cause and effect relationships between postoperative counseling and treatment outcomes(i.e. weight loss and psychological functioning) can be examined experimentally. The study will start by assessing participants' psychological health prior to surgery by using standardized self-report measures.After surgery, participants will be randomly assigned to either the intervention condition consisting of 3-monthly post-operative medical checkups plus group counseling or the treatment as usual condition (i.e. 3-monthly standard medical checkups only). Additionally, participants' psychological health will be reassessed in both groups at 3, 6, 9 and 12 months after surgery. The benefit of the experimental study design is that it allows comparing patient outcomes between groups while at the same time controlling for a wide range of potential confounding variables.The data collected are expected to make a significant contribution to the treatment challenge of one of the most pressing public health concerns worldwide. Study results will add to clinical practice by broadening and deepening our knowledge of the treatment needs of obese patients. By identifying psychological health concerns that may threaten successful treatment outcomes high-risk patient groups can be recognized early, which in turn may help to reduce postoperative weight regain and other complications.To the best of the PI's knowledge, the proposed work would be the first study of this kind in the Arab world. Findings will be helpful for developing culturally sensitive and evidence-based best-practice guidelines, which are vital to achieve satisfying long-term outcomes. Moreover, study results will be relevant for research communities and practitioners outside the MENA region since empirical support for the effectiveness of obesity surgery remains weak internationally.",Obesity|Bariatric Surgery
NCT03776227,A Bioequivalence Study Testing Two Formulations of Sotagliflozin in Healthy Male and Female Subjects Under Fasted Conditions,Primary Objective:To determine the bioequivalence of a single dose of one tablet of sotagliflozin (test) compared to two tablets of sotagliflozin (reference) under fasting conditions in healthy male and female subjectsSecondary Objectives:* To evaluate the single-dose pharmacokinetics of sotagliflozin following administration of one tablet sotagliflozin (test) compared to two tablets of sotagliflozin (reference) in healthy male and female subjects under fasting conditions* To evaluate safety and tolerability of one tablet sotagliflozin (test) compared to two tablets of sotagliflozin (reference) administered under fasted conditions in healthy male and female subjects,Type 2 Diabetes Mellitus|Healthy Subjects
NCT01621776,Effect of Apidra Compared to Humalog in Decreasing Post-Prandial Hyperglycemia,"This study aims to compare the post-meal blood glucose values of two drugs in a ""real-world"" setting.",Type 1 Diabetes
NCT05024227,The Effect of Nursing Education Intervention on Women's Health Literacy of Plasticizers,"Environmental hormone (environmental hormone), also known as ""endocrine disrupting chemicals"" (EDCS), is a pollutant that affects the endocrine system and causes diseases and dysfunction throughout the life cycle. Many daily products are ubiquitous, and the most common are phthalates (plasticizers); in recent years, many scientific research reports have determined the adverse health effects of phthalates, including: Infertility (Den Hond et al. al., 2015), testicular hypoplasia (Fisher, 2004), obesity (Dirtu et al., 2013), diabetes (Fénichel \& Chevalier, 2017), hyperglycemia (Williams et al., 2016), asthma (Wang et al., 2016) al., 2015), endometriosis and high abortion rate (Roy et al., 2015), polycystic ovary syndrome (Vagi et al., 2014), prostate cancer (Chuang et al., 2020), and Breast cancer (Chen et al., 2020; Fu et al., 2017; Holmes et al., 2014; López-Carrillo et al., 2010), etc. In 2011, the Taiwan Food and Drug Administration detected di（2-ethylhexyl）phthalate (DEHP) and dibutyl phthalate (DBP) in foods, food supplements, and beverages, and determined that the Taiwanese population has a high content of phthalates (Yang et al., 2013). It pointed out that exposure to plasticizers in the uterus will have lifelong effects and even endanger the health of the next generation, indicating that there is a significant positive correlation between the concentration of metabolites in the urine of pregnant women and the urine of their children (Lin et al., 2011; Wu et al., 2013), even related to children's autism (Carter \& Blizard, 2016; Rossignol et al., 2014).However, so far there is still a lack of research on environmental hormone-plasticizers to improve health literacy or develop interventional research. Therefore, this study hopes to track the health literacy of their plasticizers and provide nursing education interventions (including e-health platform assistance) for women. Randomized controlled trials (English: randomized controlled trial, RCT) will be used to test nursing education interventions using a double-blind trial system. (Including e-health platform assistance) Effectiveness, in order to provide simple and fast self-health monitoring and management for the people, and it is expected that the case can early prevent the occurrence of related diseases and ensure the safety of the living environment.",Endocrine Disrupting Chemicals|Health Literacy
NCT03446573,Switch Study to Evaluate Dolutegravir Plus Lamivudine in Virologically Suppressed Human Immunodeficiency Virus Type 1 Positive Adults (TANGO),"The aim of the study is to establish if human immunodeficiency virus type 1 (HIV-1) infected adult participants with current virologic suppression on a \>=3-drug tenofovir alafenamide (TAF) based regimen (TBR) remain suppressed upon switching to a two-drug regimen of dolutegravir (DTG) 50 milligram (mg) + lamivudine (3TC) 300 mg. This study will also provide important information regarding the safety and participant satisfaction with this two-drug regimen. The primary objective of this trial is to demonstrate the non-inferior antiviral activity of switching to DTG + 3TC once daily compared to continuation of TBR over 48 weeks in HIV-1 infected, antiretroviral therapy (ART)-experienced, virologically suppressed participants. This study also will characterize the long-term antiviral activity, tolerability and safety of DTG + 3TC compared to TBR through Week 144 and characterize the long-term antiviral activity, tolerability and safety of DTG + 3TC through Week 200.This will be a 200-week, Phase III, randomized, open-label, active-controlled, multicenter, parallel- group study. The study will include a screening phase (up to 28 days), a randomized early switch phase (Day 1 up to Week 148), a randomized late switch phase (Week 148 up to Week 200), and a continuation phase (post Week 200). HIV-1 infected adults on stable TBR will be randomized 1:1 to switch to DTG + 3TC once daily for up to 200 weeks, or to continue their TBR for 148 weeks, at which time and if HIV-1 ribonucleic acid (RNA) \<50 copies per milliliter (c/mL) at Week 144, these participants will switch to DTG + 3TC up to Week 200.",HIV Infections
NCT04647773,To Evaluate the Efficacy and Safety of HSK16149 Capsule in Chinese Patients With Diabetic Peripheral Neuropathic Pain,Investigate the efficacy and safety of HSK16149 capsules in Chinese diabetic peripheral neuropathic pain (DPNP) following 13 weeks treatment in comparison to placebo.,Diabetic Peripheral Neuropathic Pain
NCT06660173,A Study of Maridebart Cafraglutide in Adult Participants With Type 2 Diabetes Mellitus (T2DM),The main purpose of this study is to assess the dose-response relationship of maridebart cafraglutide on glucose control compared with placebo.,Type 2 Diabetes Mellitus (T2DM)
NCT05596773,Community-Based Chronic Disease Care in Rural Lesotho,"This ComBaCaL cohort study is to assess the impact of community-based, lay-led chronic disease screening and care interventions in rural Lesotho. It aims to establish a prospective research and service delivery platform in rural Lesotho that is managed by eHealth-supported Chronic Care Village Health Worker (CC-VHWs) providing regular chronic disease screening, monitoring and referral services. The implementation outcomes of the cohort as well as the effect of the cohort activities on disease-specific care cascades will be assessed. Subsequently, nested trials to assess the effectiveness of specific chronic disease control interventions will be developed. Measurements and data entry will be conducted by CC-VHWs. The CC-VHWs will be equipped with the essential tools required for chronic disease monitoring in the community (i.e. BP machines, scales, measuring band, glucometers, and urine dipsticks). They will undergo a theoretical and practical training covering all aspects required for correct data collection and chronic disease screening, diagnosing, referral and counselling services. At every visit, the CC-VHW will screen participants for warning signs and symptoms (i.e. shortness of breath, severe headache, chest pain, new-onset confusion, impaired consciousness, severely impaired general state of health) and refer participants to the closest health centre in case of any danger-sign. The CC-VHWs will be continuously monitored and supervised by health centre nurses of the respective village's catchment area, mainly through direct interaction during monthly VHW meetings and by CC nurses through field visits, remote interaction via phone calls or messages sent via the ComBaCaL app and through direct contact during the monthly VHW meetings at the health centre. The CC-VHWs are embedded within the Lesotho MoH VHW program and may during the project period be trained and equipped to provide further routine services in their communities.",Non-communicable Diseases (NCDs)
NCT03403231,INcreasing Veteran EngagemeNT to Prevent Diabetes (INVENT),"This study will evaluate a VA MyHealtheVet Secure Messaging intervention that uses different intervention messaging strategies designed to increase engagement in behaviors to prevent type 2 diabetes.The investigators will enroll 144 eligible Veterans into a 12-week MyHealtheVet Secure Messaging intervention. Eligible Veterans include those who are currently using MyHealtheVet secure messaging, meet inclusion/exclusion criteria, and have received an HbA1c test within the last 6 months that meets the ADA/CDC classification for prediabetes. Study participants will be surveyed about their engagement in behaviors to prevent TDM2 and mediators of this engagement. After completing a baseline survey, participants will be randomly assigned to receive different novel presentations of information about ways to prevent T2DM through both Secure Messaging and US Mail. The investigators will test the 5 presentations that each: (1) represent an innovative approach from behavioral economics or health psychology with great promise to increase engagement in behaviors to prevent T2DM among patients with prediabetes; and (2) have not been tested in this setting.",Prediabetes
NCT01628627,Frequency Modulated Neural Stimulation (FREMS) in Symptomatic Diabetic Neuropathy,Aim of this study is to evaluate safety and efficacy of transcutaneous frequency modulated electromagnetic neural stimulation (FREMS) to treat symptomatic peripheral neuropathy in patients with diabetes mellitus.,"Diabetic Neuropathy, Painful"
NCT01987427,"A Multicenter, Double-blind, Randomized, Parallel-group, Pilot Study of 12-week Duration to Assess the Short-term Safety and Tolerability of Lorcaserin Plus Two Doses of Immediate-Release Phentermine-HCl Compared With Lorcaserin Alone in Overweight and Obese Adults","APD356-A001-402 is a multicenter, double-blind, randomized, parallel-group pilot study of 12-week duration in overweight and obese adults. Approximately 225 subjects will be randomized to one of three treatment arms in a ratio 1:1:1 and will receive the combinations of lorcaserin 10 mg twice daily (BID) plus immediate-release phentermine-HCl 15 mg BID or 15 mg once daily (QD), or lorcaserin alone.",Chronic Weight Management
NCT04799327,The Effect of SHR20004（Noiiglutide ） on Body Weight in Obese Subjects Without Diabetes,The study is being conducted to assess the efficacy and safety of SHR20004 on body weight in obese subjects without diabetes.,Obesity
NCT02706873,A Study to Compare Upadacitinib (ABT-494) Monotherapy to Methotrexate (MTX) Monotherapy in Adults With Rheumatoid Arthritis (RA) Who Have Not Previously Taken Methotrexate,"The objectives of Period 1 were the following:* To compare the safety and efficacy of upadacitinib 7.5 mg once daily (QD) monotherapy (for participants in Japan only), 15 mg QD monotherapy, and 30 mg QD monotherapy versus weekly methotrexate monotherapy for the treatment of signs and symptoms of RA in methotrexate-naïve adults with moderately to severely active RA;* To compare the efficacy of upadacitinib 15 mg QD monotherapy and upadacitinib 30 mg QD monotherapy versus weekly methotrexate monotherapy for prevention of structural progression in methotrexate-naïve adults with moderately to severely active RA.The objective of Period 2 is to evaluate the long-term safety, tolerability, and efficacy of upadacitinib 7.5 mg QD (for participants in Japan only), 15 mg QD, and 30 mg QD in adults with RA who have completed Period 1.",Rheumatoid Arthritis
NCT03334773,Nutrition Education Intervention for Adults With Type 2 Diabetes,"Aim: To implement a nutrition education programme (intervention) for adults with type 2 diabetes mellitus (T2DM) adapted from a primary health care setting to a tertiary hospital setting in South Africa and to evaluate the programme's effectiveness on dietary behaviours, clinical status and selected potential behaviour mediators.Participants and setting: T2DM adults (40-70 years) and at least one year of living with diabetes and poorly controlled diabetes (HbA1c ≥ 8%). The study setting is the outpatient clinic of a tertiary teaching hospital in Tshwane District (Pretoria), South Africa.Intervention: The intervention will employ a randomised control design with two parallel groups (intervention \& control). A total sample of 140 T2DM patients (70 per group) will be needed to detect a 0.5 % change in HbA1c (SD of 1.0 and a power of 80%) at six month and allowing a 10% attrition rate. The intervention is one-year long with the following components: 7-monthly group education sessions; 2 bi-monthly group follow-up sessions at the hospital till one year; participants' workbook for goal setting activities and education materials (pamphlet and wall/fridge poster) for the intervention group. The control group will receive the same education materials with no other education encounters. Both groups will continue with usual care at the diabetes outpatient clinic of the hospital. The education will be offered face to face, will utilize teaching aids including coloured posters and will incorporate interactive group activities and demonstrations. The main facilitator is a qualified dietitian.Outcomes: Outcomes will be assessed at 6-and 12 months for both groups with the six month being the primary outcome. Outcomes will include clinical \[HbA1c (primary outcome), BMI, blood pressure and full lipid profile); dietary behaviours (energy intake, starchy food servings, vegetable and fruits intake, macronutrient intake and their distribution to energy, fibre, meal pattern) and selected potential mediators of behavior (diabetes knowledge and diabetes management self- efficacy).It is hypothesized that the intervention will lower the HbA1c levels by at least 0.5% at six months and the levels will be significantly lower in the intervention group compared with the control group, and the significantly lower levels will be sustained at 12 months in the intervention group.",Type 2 Diabetes Mellitus
NCT00330473,A Concordance Study Comparing Insulin Treatments in Patients With Type 2 Diabetes,A study to compare insulin use and its effect on glucose control and other outcomes in patients with Type 2 diabetes who together with their healthcare provider manage their disease by discussing and agreeing on the diabetes treatment chosen from a selection of available treatment options.,"Diabetes Mellitus, Type 2"
NCT03459573,Fit-One: A Trial Evaluating the Effect of One Drop and Fitbit on Diabetes and Pre-diabetes Outcomes,"The Fit-One trial involves three prospective, randomized waitlist-controlled studies. These studies evaluate the effects of One Drop's digital therapeutics solution with and without Fitbit devices on the social cognitive, behavioral, and health outcomes of people with diabetes. Fit-One is being tested on adults with type 1 diabetes (T1D) of all weights, and adults with type 2 diabetes (T2D) or pre-diabetes that are overweight or obese (BMI ≥ 25).","Diabetes Mellitus, Type 2|Diabetes Mellitus, Type 1|PreDiabetes"
NCT01773473,Comparison of Insulin Mix25 Versus Mix50,The purpose of this study is to determine the efficacy and safety of insulin Lispro Mix25 (LM25) compared to insulin Lispro Mix50 (LM50) as an insulin starter in participants with Type 2 diabetes mellitus (T2DM).,Type 2 Diabetes Mellitus
NCT03308773,Disease Prevention in Clinical Practice Base on Patient Specific Physiology,"It is well known that the Type 2 diabetes and vascular disease are preceded by over ten years by metabolic dysfunction and anatomic changes that can be quantified. In order to develop effective preventive strategies and reduce the cost burden to the health care system, recognition of the earliest pathophysiology of Type 2 diabetes and vascular disease is clinically relevant. The interval retrospective evaluation of data from patient records, reflect the effectiveness of the various treatments implemented in clinical practice.Prevalence of ""prediabetes"" among American adults is estimated to be \~84 million, or one out of three Americans. Over a 5-7 year period approximately one third of these prediabetic individuals will progress to type 2 diabetes. Prediabetes is a heterogenous group comprised of individuals with impaired fasting glucose (IFG), impaired glucose tolerance (IGT), and increased A1c (5.7-6.4%). Although different pathophysiologies are present in individuals with IFG and IGT, their conversion rate to overt type 2 diabetes mellitus (T2DM) is similar.Insulin resistance is a common causal feature of many of the pathophysiologic mechanisms linking macrovascular disease and type 2 diabetes. Because hyperglycemia is the major factor responsible for the development of microvascular complications, it logically follows that prevention of progression of prediabetes to overt diabetes should retard/prevent the development of the microvascular complications. From the measurement of plasma glucose, insulin, and c-peptide levels during the oral glucose tolerance test, one can derive measures of the two core defects responsible for the development of T2DM, i.e. insulin resistance and beta cell dysfunction as well as the degree of dysglycemia.By combining a standard medical evaluation with the evaluation of cardiovascular biomarkers, patients at intermediate risk of vascular disease can be identified. In these patients, carotid intima media thickness (IMT) and carotid plaque evaluation is offered to attempt to clarify risk.The hypothesis of this observational study is that the characterization of the physiology and anatomy of patients at risk of developing type 2 diabetes and/or cardiovascular disease can stratify risk of developing disease and direct treatment strategies tailored to the identified physiologic defect, leading to improvements in the delay or prevention of disease.",PreDiabetes|Insulin Resistance|Type2 Diabetes|NASH - Nonalcoholic Steatohepatitis|Diastolic Dysfunction|Dementia|Atrial Fibrillation|Cancer|Atherosclerosis|Carotid Plaque
NCT02471573,Freeze All Protocol Versus Fresh Embryo Transfer in Women Undergoing In-vitro Fertilization (IVF),To compare the effectiveness of freeze-all and subsequent frozen embryo transfer (freeze all protocol) with fresh embryo transfer (fresh ET).,Infertility
NCT04157673,Imagine to Remember: Improving Medication Adherence in Pre- and Type 2 Diabetes,Determine if an intervention consisting of future-thinking improves different facets of memory/executive function and/or decision-making.,Medication Adherence
NCT02405260,Add Glucokinase Activator to Target A1c,"This trial is a multi-center, adaptive, randomized, double-blind, placebo- and active- controlled, parallel group, Phase 2 study in subjects with T2DM to evaluate the effect of TTP399 on HbA1c following administration for 6 months.","Diabetes Mellitus, Type 2"
