NCT Number,Study Title,Brief Summary,Conditions
NCT04417127,Harambee: Integrated Community-based HIV/NCD Care & Microfinance Groups in Kenya,"The objective of this project is to demonstrate the effectiveness and longer-term sustainability of a differentiated care delivery model for improving HIV treatment outcomes. The central hypothesis is that the integration of community-based HIV and NCD care with group microfinance will improve retention in care and rates of viral suppression (VS) among people living with HIV (PLHIV) in Kenya via two mechanisms: improved household economic status and easier access to care.The specific aims are as follows:1. To evaluate the extent to which integrated community-based HIV care with group microfinance affects retention in care and VS among n=900 PLHIV in rural western Kenya using a cluster randomized intervention design of n=40 existing (fully HIV+) microfinance groups to receive either: (A) integrated community-based HIV and NCD care or (B) standard care. Data from the two trial arms will be augmented with a matched contemporaneous control group of n=300 patients receiving standard care and not involved in microfinance (group C), comparing outcomes in groups A, B and C. The hypothesize is that A \> B \> C in terms of viral suppression and retention in care.2. To identify specific mechanisms through which microfinance and integrated community-based care impact VS. Using a mixed methods approach, the study will characterize the mechanisms of effect on patient outcomes. Investigators will conduct quantitative mediation analysis to examine two main mediating pathways (household economic conditions and easier access to care), as well as exploratory mechanisms (food security, social support, HIV- related stigma). Investigators will also use qualitative methods and multi-stakeholder panels to contextualize implementation of the intervention.3. To assess the cost-effectiveness of microfinance and integrated community-based care delivery to maximize future policy and practice relevance of this promising intervention strategy. The working hypothesis is that the differentiated model will be cost-effective in terms of cost per HIV suppressed person-time, cost per patient retained in care, and cost per disability-adjusted life year saved.The main expected outcomes will be rigorous evidence of effectiveness, mechanisms and cost-effectiveness of a differentiated model for achieving the last key step in the HIV care continuum. These results are expected to have an important positive impact in terms of improved, high-quality services that address known individual and structural barriers to care and promote long-term sustainability of care for PLHIV in rural settings with high HIV prevalence.",HIV/AIDS|Noncommunicable Diseases|Hypertension|Diabetes
NCT00947427,Canakinumab Study in Individuals With Newly Diagnosed Type 1 Diabetes,"Canakinumab is a fully human anti-interleukin-1β (anti-IL-1β) monoclonal antibody (IgG-1 class). Canakinumab is designed to bind to human IL-1β and to functionally neutralize the bioactivity of this pro-inflammatory cytokine.The study is a two-arm, multicenter, randomized, double-masked, placebo-controlled clinical trial. 66 subjects will be randomly assigned to receive either monthly subcutaneous injections of 2.0 mg/kg Canakinumab, or placebo for 12 months. All groups will receive standard intensive diabetes treatment with insulin and dietary management.Participants randomly assigned to Canakinumab treatment or placebo will receive a total of 12 injections over one year.All subjects will be followed for 1 year of treatment plus 1- 3 years of additional follow-up until study end. Enrollment is expected to occur over two years.",Type 1 Diabetes|Preservation of Insulin Secretion|Newly Diagnosed Type 1 Diabetes|Canakinumab in Type 1 Diabetes
NCT02614027,Prevalence of Lipodystrophy Syndrome and Its Role as Cause of Metabolic Disturbances,"To evaluate the prevalence of lipodystrophy syndrome in patients receiving currently available antiretroviral drugs, and the prevalence of associated metabolic syndrome in HIV-infected patients with a previous diagnosis of lipodystrophy syndrome, according to the severity of fat accumulation and antiretroviral drug use.",Lipodystrophy|Metabolic Syndrome
NCT01462227,Effect of Naltrexone on Counterregulatory Mechanisms in Hypoglycemia,"Insulin treatment often causes the blood glucose levels to fall too low. The body usually responds to low blood glucose levels by releasing hormones which act against the insulin to help correct the low blood glucose levels. However, this hormone response can be altered in people with diabetes. Currently there are no therapeutic agents that can be used to improve the recovery from hypoglycemia (low blood sugar). Naltrexone is a tablet used to help people who are addicted to alcohol or morphine-based drugs to remain drug and alcohol-free but it can also affect the levels of the hormones which are released during hypoglycemia. The aim of this study is to determine whether naltrexone can be used to improve and accelerate the recovery from hypoglycemia in patients with type 1 diabetes.",Hypoglycemia
NCT05149573,Investigation of PEMF Therapy for Female Patients With IC/BPS,"The purpose of this study is to gather information about the safety and effectiveness of the non-pharmacological (non-drug), non-invasive treatment known as low-frequency pulsed electromagnetic field (PEMF) therapy. The study team will distribute the PEMF device to female adults with Interstitial Cystitis/Bladder Pain Syndrome (IC/BPS) to measure its ability to decrease bladder and pelvic pain as well as other urinary symptoms associated with IC/BPS. There are two sequential Aims in this study and subjects will be recruited to participate in only one Aim. In both Aims, data will be collected at baseline/enrollment, 4-weeks after using PEMF therapy, and 8, 12, and 16 weeks post-enrollment.",Interstitial Cystitis|Chronic Interstitial Cystitis|Bladder Pain Syndrome
NCT01170273,Vitamin D in Vulnerable Adults (VIVA-VA),"Vitamin D insufficiency is a problem of growing concern, given its prevalence in older persons and the association of low vitamin D with multiple major health problems, including mobility and balance deterioration and falls, cardiovascular disease, diabetes, and certain cancers. Sedentary persons are particularly vulnerable for these health problems and generally not adherent to prescribed physical activity. This study will investigate if treatment with vitamin D will benefit physical performance in male veterans age 65 to 95.",Frail Elderly|Vitamin d Deficiency
NCT00609973,Ciprofloxacin for the Prevention of Postoperative Endoscopic Recurrence in Crohn's Disease,"Despite extensive medical treatment, surgical resection is required in approximately 70% of the patients at some time. However, recurrence of the disease after operation occurs in the majority of patients and is a serious limitation of surgical management. Therapeutic options to maintain postoperative clinical remission are urgently needed. Several drugs including mesalazine, antibiotics (metronidazole, ornidazole) and azathioprine or 6-mercaptopurine have been studied in the past. But the efficacy is very limited (mesalazine), overshadowed by intolerability during long-term therapy (metronidazole, ornidazole) or inconclusive (azathioprine or 6-mercaptopurine). Research demonstrating the absence of inflammation in patients with diverting ileostomy and the clinical benefit of a postoperative antibiotic therapy using metronidazole or ornidazole implicates a role of the resident bacterial flora in the postoperative relapse. Ciprofloxacin has a broad antibacterial spectrum. More interestingly it also suppresses E. coli strains, which can be found in high numbers in early and chronic ileal lesions of Crohn's disease patients Ciprofloxacin has demonstrated beneficial effects in the therapy of inflammatory bowel diseases, but the available data of the effectiveness of ciprofloxacin allow only a very limited judgement of the safety and tolerability of a 6 months therapy of ciprofloxacin. Therefore an exploratory multicenter prospective, placebo-controlled trial is planned to analyze the safety and tolerability of a 6 months therapy with ciprofloxacin compared to placebo in 40 patients (randomly assigned in a 1:1 ratio) undergoing ileocecal resection (or resection of parts of the colon). If this therapeutic regimen demonstrates tolerability, a second larger study improving the superiority of ciprofloxacin versus placebo can be initiated.",Crohn's Disease
NCT03679273,Nutritional Supplement on Wound Healing in Diabetic Foot,"Diabetic foot ulcer (DFU) is the leading cause of non-traumatic limb loss in adult worldwide. One of the major causes of limb loss in patients with DFU is poor wound healing. It is known that nutrition plays a key role in wound healing, not only because of the required calories, but more importantly for collagen remodeling by specific amino acids (arginine, glutamine, and β-hydroxy-β-methylbutyrate).Nevertheless, few studies have investigated nutritional supplements in patients with poor wound healing of DFU. Difficulties in assessing the severity of a wound and poor adherence to drug and food supplements at home may be important factors for the negative results shown in a most recent prospective randomized controlled trial. The diabetic foot center in Chang Gung Memorial hospital has extensive experience in caring for patients with limb-threatening DFU and we recently reported that poor nutritional status in our patients correlated to poor treatment outcomes. The aim of this study is to evaluate the clinical efficacy and possible molecular mechanisms in nutritional treatment for limb-threatening DFU. A total of 70 patients will be enrolled and randomized into study and control groups. All subjects will receive standard care. Additional amino acid supplements containing arginine, glutamine, and β-hydroxy-β-methylbutyrate or a control (high protein formula powder) will be given orally twice a day for 21 days, and the percentage change in wound size will then be measured. Complete healing time, recurrence or major adverse cardiac events will be recorded during one year of follow up. Data on wound size, nutritional status, and levels of matrix metallopeptidase (MMP)-2, MMP-9, nutrient molecules (measured by ABSOLUTE/DQ P180 KIT (LC MS/MS) will be recorded before and after the nutritional supplementation. In addition, the pioneer factor forkhead box protein A2 (FOXA2) that binds native chromatin and bookmarks genomic regions for transcriptional activity may play a role in nutritional supplements in acute stressed diabetic patients. Therefore, we intend to conduct a pilot study on the for FOXA2 gene in maintaining glucose homeostasis in diabetic foot patients after nutritional interventions.",Diabetic Foot
NCT05214573,Second-line Therapies for Patients with Type 2 Diabetes and Moderate Cardiovascular Disease Risk,"We will use the target trial framework for causal inference to conduct this observational retrospective cohort study that uses claims data of adults with type 2 diabetes (T2D) included in the de-identified datasets of OptumLabs Data Warehouse (OLDW) and Medicare fee-for-service.In Aim 1, we will emulate a target trial comparing the effectiveness of glucagon-like peptide-1 receptor agonists (GLP-1RA), sodium-glucose cotransporter 2 inhibitors (SGLT2i), dipeptidyl peptidase-4 inhibitors (DPP-4i), and sulfonylureas (SU) in adults with T2D at moderate risk of cardiovascular disease (CVD) with regard to major adverse cardiovascular events (MACE), expanded MACE, microvascular complications, severe hypoglycemia, and other adverse events.In Aim 2, we will compare these four drug classes in the same population of adults with T2D included in OLDW and Medicare fee-for-service data with respect to a set of composite outcomes identified by a group of patients with T2D as being most important to them. Specifically, in Aim 2A, we will prospectively elicit patient preferences toward various treatment outcomes (e.g., hospitalization, kidney disease) using a participatory ranking exercise, then use these rankings to generate individually weighted composite outcomes. Then, in Aim 2B, we will estimate patient-centered treatment effects of four different second-line T2D medications that reflect the patient's value for each outcome.In Aim 3, we will compare different medications within each of the four therapeutic classes with respect to MACE.",Type 2 Diabetes|Cardiac Disease
NCT05702931,Semaglutide Treatment for Hyperglycaemia After Renal Transplantation,"Background: Post-transplant hyperglycaemia occurs frequently in renal transplant recipients within the first two weeks after transplantation. Standard-of-care is primarily based on insulin treatment with the adherent risk of hypoglycaemia and weight gain. Semaglutide produces an effective lowering of plasma glucose in diabetes patients with chronic kidney disease (CKD) and leads to a reduction in weight and the incidence of hypoglycaemia. The efficacy of semaglutide is untested in renal transplant recipients, and safety concerns remain, primarily on renal graft function.Objectives: The primary objective is to establish whether tablet semaglutide (Rybelsus) compared with placebo, both as add-on to standard-of-care, is non-inferior in regulating plasma glucose in patients with hyperglycaemia after renal transplantation. Secondary objectives aim to evaluate the effect of tablet semaglutide on renal graft function, weight, use of insulin, cardiovascular parameters and safety parameters (plasma semaglutide concentration, gastrointestinal side effects, dose of immunosuppressants).Design: An investigator-initiated, placebo-controlled, double-blinded, parallel-group, randomised trial.Population: Patients (n = 104) with post-transplant hyperglycaemia and an estimated glomerular filtration rate (eGFR) \> 15 ml/min/1.73 m2.Methods: Participants diagnosed with post-transplant hyperglycaemia, 10 to 15 days post-transplant, will be randomised 1:1 to either 14 weeks of tablet semaglutide once daily or placebo both as add-on to standard glucose-lowering therapy. Participants will maintain weekly contact with the clinic during the first five weeks and at two to four weeks intervals during the remaining study period. During the trial, each patient will be monitored according to blood laboratory values with safety assessed at every visit by a nephrologist. Pre-prandial plasma glucose will be measured in the morning and evening to adjust glucose-lowering therapy after consultation with an endocrinologist. Double blinded continuous glucose monitoring (CGM) will be performed for 10-14 days from baseline and at weeks 5, 9, and 13.Primary endpoint:- Mean sensor glucose (mmol/L) evaluated by CGMKey secondary endpoints:* Incidence of hypoglycaemia* Body weight (kg)* Creatinine (μmol/L)* Daily insulin dose (IE per day)* Plasma concentration of semaglutide (nmol/L)* Blood concentrations of cyclosporine and tacrolimus (μg/L)",Hyperglycemia|Renal Transplant Complication Primary Non-Function|Diabetes
NCT06495931,"Study on Drug Interaction of HRS-1780 Tablets, Henagliflozin Tablets, Metformin Tablets and HRS-7535 Tablets in Healthy Human","This study was designed as a single-center, single-arm, open, fixed-sequence, self-controlled trial in healthy subjects.",Type 2 Diabetes Mellitus
NCT06997731,Clinical Efficacy of Local Delivery of Minocycline and Hyaluronan Gel to Treat Periodontitis in Diabetic Patients,The goal of this clinical trial is to investigate the local delivery of minocycline gel 2% and 0.2% hyaluronan gel to treat periodontitis in diabetic patients as adjunctive to subgingival instrumentation. The main question it aims to answer is: Does local use of minocycline gel and hyaluronan gel as an adjunct to SRP have resulted in significant additional improvement in the clinical conditions of stage II grade B periodontitis patients when compared with SRP alone?,Periodontitis and Diabetes|Periodontitis
NCT01954927,Pain Management in Children and Young Adults With Sickle Cell Disease,"This is a phase II double-blind placebo-controlled clinical trial evaluating the effect of gabapentin when added to standard pain management for patients with sickle cell disease experiencing acute pain crisis in the ambulatory care setting.Sickle cell pain is different for every patient. Some patients get complete relief from routine pain medicines, and others need more time or more doses of pain medicines before the pain goes away completely. It is known that humans have many types of pain, including something called neuropathic pain. Neuropathic pain in other conditions (such as diabetes) has been treated successfully with a medicine called gabapentin. The investigators in this study suspect that some sickle cell pain is a combination of pain types. They would like to see if adding gabapentin to the usual pain medicines makes pain go away faster or more completely.Primary Objective:* To assess the analgesic efficacy of gabapentin vs. placebo for pain during vaso-occlusive crisis (VOC) in participants with sickle cell disease (SCD). A response to study drug will be defined by a decrease in pain score of ≥ 33% between presentation to the acute care setting and assessment at 3 hours post administration of study drug.Secondary Objective:* To compare the total morphine equivalent dose (mg/kg) used to control pain during VOC between presentation to the acute care setting and assessment at 3 hours post administration of study drug in the gabapentin vs. placebo groups.",Sickle Cell Disease
NCT00493727,Use of Mucomyst to Ameliorate Oxidant Stress in Diabetics With Proteinuria,"The study will look at the effect of 30 days of treatment of 15 diabetics with proteinuria with N-acetylcysteine ( Mucomyst ) at a dose of 1 gm twice a day by mouth. The primary outcome that will be measured is change in the oxidant stress as measurable by changes in the serum level of isoprostane, Glutathione peroxidase, aconitase and Total oxidant stress. Secondary outcomes measured will be changes in proteinuria and kidney function as measured by spot urine pr/cr and estimated GFR by MDRD formula.",Diabetes|Proteinuria
NCT01657227,Tertiary Prevention in Type II Diabetes Mellitus in Canary Islands Study,"Objective:* To improve health outcomes of patients with type 2 diabetes mellitus (T2DM) by influencing disease self-management through lifestyle modification and by helping primary care professionals to improve health care provided to patients.* To assess the effectiveness and cost-effectiveness of two complex interventions (education and behavioural modification, independently and conjointly, for primary health care teams (PHCT) and patients and their relatives) to improve the health results in people with T2DM.Methodology:Design: Randomized clinical trial. Setting: Basic healthcare district in Canary Islands. Spain. Subjects: Patients with T2DM, 18-65 years old, without complications. Main measures: HbA1c, rate of patients with properly controlled T2DM. Sample: 2328 patients, 582 per arm. Intervention: G1: Interventions on the patients: Educational and habit modification group program. G2: Intervention on the PHCT: a) Educative intervention to improve the knowledge about the disease and their abilities; b) Computer-based clinical decision support system; c) Feedback of results. G3: Interventions on the patients and the PHCT. G4: Control group. Patients receive only the usual care.",Type 2 Diabetes Mellitus
NCT00212173,Adolescent Weight Management Study,"Protocol #1:The goals of this study was to examine whether increased weight loss in obese adolescent is induced when the weight loss medication sibutramine is added to a family-based, behavioral weight control program.Protocol #2: This study aims to improve the behavioral treatment of obesity during adolescence. A behavioral program using regular foods will be compared to a behavioral program using a structured meal plan (a portion-controlled approach with liquid-meal replacements \[nutritional supplements\]). This structured approach may be better for the promotion of weight loss compared to a diet of regular foods.",Protocol #1:Behavioral Therapy + Placebo or Sibutramine|Protocol #2: Behavioral Therapy + Meal Replacement or Conventional Food
NCT01505673,Adding Liraglutide to High Dose Insulin: Breaking the Cycle,"The purpose of this study is to evaluate whether the addition of liraglutide 1.8 mg/day to a high-dose insulin regimen (\>1.8 units/kg/day) in patients with uncontrolled (HbA1c \>7.5%) type 2 diabetes mellitus will improve blood sugar control.It also evaluates the effect of liraglutide on liver and pancreatic fat content, explores the mechanism of blood sugar improvement by assessing weight and pancreatic hormone release, and assesses blood pressure, lipid profile, and liver function. Finally it will look at patient quality of life and safety.",Type 2 Diabetes Mellitus|Obesity
NCT03135873,Mastiha Treatment for Obese With NAFLD Diagnosis,"NAFLD/NASH is one of the most common complications of obesity and diabetes mellitus in Western populations affecting approximately 50% of diabetics and 76% of obese patients. Due to the lack of specialized treatment, many new efforts focus on exploring alternative, non-pharmacologic means for managing the disease, including bioactive substances in fruits, vegetables and plants or their products. Mastiha, a natural product of Greece, consists of a great variety of bioactive phytochemical compounds and demonstrates antioxidant, antiinflammatory, antimicrobial and lipid lowering properties. Taking into account the contribution of oxidative stress and inflammation to NAFLD/NASH pathogenesis, the hypothesis that Mastiha could improve disease aspects is investigated. Thus, design of a multicenter (4 centers across Europe), randomized, double-blind, placebo controlled (parallel arm) clinical trial to assess the effect of Mastiha on clinical course of NAFLD/NASH patients has been conducted. The effectiveness of the proposed intervention will be evaluated via clinical and laboratory markers. MAST4HEALTH aims also at exploring gene-diet interactions and at correlating genetic and epigenetic markers with metabolomic and intestinal microbiota profiles pre- and post- intervention. To this end, patients with confirmed NAFLD/NASH will be allocated to either verum or placebo group. Duration of the intervention will be 6 months and the dosage applied will be 2.1 g daily. NAFLD/NASH diagnosis will be confirmed by MS scanning and the sensitive LiverMultiScan technique. Anthropometric, demographic data, body composition, dietary habits, physical activity, family history and smoking status will be assessed pre- and post- intervention. Biochemical profile, oxidative stress and inflammation, as well as epigenetic and metabolomic profiles will be assessed in blood samples, while the metagenome profile will be examined in stools. Both groups will receive counselling to allow for body weight regulation up to 5%. Compliance will be assessed monthly and side effects will be reported.",Non Alcoholic Fatty Liver Disease
NCT05334173,Gastric Bypass With Different Lengths of the Bilipancreatic Limb,"Laparoscopic Roux-en-Y Gastric Bypass (LRYGB) has been the most performed bariatric surgical intervention until a few years ago, due to its good results in terms of weight loss and remission of comorbidities such as hypertension, type 2 diabetes mellitus, dyslipidemia and obstructive sleep apnea syndrome. However, more than 25% of patients do not obtain the expected result.There is no uniform technique to perform a LRYGB, but traditionally it was constructed using a long alimentary limb (AL) and a short biliopancreatic limb (BPL). There is no current consensus on the ideal length of the LRYGB limbs.The distal gastric bypass at the expense of a longer biliopancreatic limb (LBPL-GB) could induce more excess of weight loss (EWL%), but with possible protein malnutrition depending on the length of the remaining common limb.The aim of this study is compare a LBPL-GB (BPL 150cm, AL 70cm) with LAL-GB (BPL 70cm, AL 150cm).PRIMARY OUTCOME: to evaluate if there are differences in weight loss. SECONDARY OUTCOME: to assess whether there are differences in both groups in remission of the most common comorbidities and in quality of life.DESIGN: multicenter, prospective, randomized study in blocks (1:1), blinded for the patient and to the surgeon up to the time of intervention, in patients with indication of RYGB for obesity (BMI\>35 with associated comorbidity or BMI\>40 with or without comorbidity, excluding those of BMI\>50). Intervention: LRYGB type 1 (LAL-GB: 150cm ALand 70cm BPL) or type 2 (LBPL-GB: 70cm AL and 150cm BPL).The expected result is that the patients with LBPL-GB present better EWL%, and higher remission of their comorbidities than the comparison group","Laparoscopic-Roux-en-Y Gastric Bypass|Obesity|Diabetes Mellitus, Type 2|Hypertension|Dyslipidemias|Sleep Apnea"
NCT00694473,Continuous Glucose Monitoring With a Subcutaneous Sensor During Critical Illness and Surgery,"We hypothesize that measurements of interstitial fluid (ISF) glucose by the FreeStyle Navigator (Abbot Diabetes Care), a continuous glucose monitoring system, will correlate with blood glucose (BG) values in surgical and ICU patients with a clinically useful degree of accuracy.",Critical Illness
